{
  "$schema": "https://json-schema.org/draft/2020-12/schema",
  "$id": "https://synergy.local/schemas/synergy.cognitive-plan.v1.schema.json",
  "title": "SYNERGY Cognitive Plan Proposal v1",
  "type": "object",
  "additionalProperties": false,
  "required": [
    "schema",
    "goal",
    "steps"
  ],
  "properties": {
    "schema": {
      "const": "synergy.cognitive-plan.v1"
    },
    "goal": {
      "type": "string",
      "minLength": 1
    },
    "steps": {
      "type": "array",
      "minItems": 1,
      "items": {
        "type": "object",
        "additionalProperties": false,
        "required": [
          "id",
          "objective",
          "plugin_id",
          "capability"
        ],
        "properties": {
          "id": {
            "type": "string",
            "minLength": 1
          },
          "objective": {
            "type": "string",
            "minLength": 1
          },
          "plugin_id": {
            "type": "string",
            "minLength": 1
          },
          "capability": {
            "type": "string",
            "minLength": 1
          },
          "hints": {
            "type": "object"
          }
        }
      }
    },
    "bindings": {
      "type": "array",
      "default": [],
      "items": {
        "type": "object",
        "additionalProperties": false,
        "required": [
          "from_step",
          "to_step",
          "to_field",
          "transform"
        ],
        "properties": {
          "from_step": {
            "type": "string",
            "minLength": 1
          },
          "to_step": {
            "type": "string",
            "minLength": 1
          },
          "to_field": {
            "type": "string",
            "minLength": 1
          },
          "transform": {
            "type": "object",
            "additionalProperties": false,
            "required": [
              "ops"
            ],
            "properties": {
              "ops": {
                "type": "array",
                "maxItems": 16,
                "items": {
                  "oneOf": [
                    {
                      "type": "object",
                      "additionalProperties": false,
                      "required": [
                        "op",
                        "field"
                      ],
                      "properties": {
                        "op": {
                          "const": "get_field"
                        },
                        "field": {
                          "type": "string",
                          "minLength": 1
                        }
                      }
                    },
                    {
                      "type": "object",
                      "additionalProperties": false,
                      "required": [
                        "op",
                        "index"
                      ],
                      "properties": {
                        "op": {
                          "const": "index"
                        },
                        "index": {
                          "type": "integer",
                          "minimum": 0,
                          "maximum": 1024
                        }
                      }
                    },
                    {
                      "type": "object",
                      "additionalProperties": false,
                      "required": [
                        "op"
                      ],
                      "properties": {
                        "op": {
                          "const": "first"
                        }
                      }
                    },
                    {
                      "type": "object",
                      "additionalProperties": false,
                      "required": [
                        "op",
                        "field"
                      ],
                      "properties": {
                        "op": {
                          "const": "map_field"
                        },
                        "field": {
                          "type": "string",
                          "minLength": 1
                        }
                      }
                    },
                    {
                      "type": "object",
                      "additionalProperties": false,
                      "required": [
                        "op",
                        "field",
                        "value"
                      ],
                      "properties": {
                        "op": {
                          "const": "filter_eq"
                        },
                        "field": {
                          "type": "string",
                          "minLength": 1
                        },
                        "value": {}
                      }
                    },
                    {
                      "type": "object",
                      "additionalProperties": false,
                      "required": [
                        "op",
                        "output_schema"
                      ],
                      "properties": {
                        "op": {
                          "const": "parse_json"
                        },
                        "output_schema": {
                          "type": "object"
                        }
                      }
                    },
                    {
                      "type": "object",
                      "additionalProperties": false,
                      "required": [
                        "op",
                        "separator"
                      ],
                      "properties": {
                        "op": {
                          "const": "join_strings"
                        },
                        "separator": {
                          "type": "string",
                          "maxLength": 32
                        }
                      }
                    },
                    {
                      "type": "object",
                      "additionalProperties": false,
                      "required": [
                        "op",
                        "min_length"
                      ],
                      "properties": {
                        "op": {
                          "const": "assert_string"
                        },
                        "min_length": {
                          "type": "integer",
                          "minimum": 0,
                          "maximum": 1000000
                        },
                        "max_length": {
                          "oneOf": [
                            {
                              "type": "integer",
                              "minimum": 0,
                              "maximum": 1000000
                            },
                            {
                              "type": "null"
                            }
                          ]
                        }
                      }
                    }
                  ]
                }
              }
            }
          }
        }
      }
    }
  }
}
